{
  "assessment_version": "1.1",
  "claim_boundary": "Deterministic source-only structural and scorer readiness for assessment v1.1; this report is not psychometric calibration, clinical or cultural validation, accessibility-population or fairness evidence, participant or longitudinal validation, release authorization, mastery evidence, or intervention-effectiveness evidence. All eight participant evidence axes remain open.",
  "contract_version": "GG-ASSESSMENT-CALIBRATION-READINESS-1.0",
  "coverage": {
    "capability_clarifier_coverage_complete": true,
    "coverage_artifact_matches": true,
    "direct_capability_coverage_complete": true,
    "lever_rows": [
      {
        "all_core_signal_ids": [
          "Q13",
          "Q15",
          "Q48"
        ],
        "allows_not_applicable": true,
        "capability_clarifier_id": "C_L01",
        "core_weight_sum": 1.5,
        "direct_core_item_ids": [
          "Q13"
        ],
        "effective_core_item_count": 2.0,
        "lever_id": "L01"
      },
      {
        "all_core_signal_ids": [
          "Q13",
          "Q14",
          "Q37",
          "Q43",
          "Q45"
        ],
        "allows_not_applicable": true,
        "capability_clarifier_id": "C_L02",
        "core_weight_sum": 1.85,
        "direct_core_item_ids": [
          "Q14"
        ],
        "effective_core_item_count": 2.894,
        "lever_id": "L02"
      },
      {
        "all_core_signal_ids": [
          "Q15",
          "Q16"
        ],
        "allows_not_applicable": true,
        "capability_clarifier_id": "C_L03",
        "core_weight_sum": 1.15,
        "direct_core_item_ids": [
          "Q15"
        ],
        "effective_core_item_count": 1.293,
        "lever_id": "L03"
      },
      {
        "all_core_signal_ids": [
          "Q15",
          "Q16",
          "Q41"
        ],
        "allows_not_applicable": true,
        "capability_clarifier_id": "C_L04",
        "core_weight_sum": 1.3,
        "direct_core_item_ids": [
          "Q16"
        ],
        "effective_core_item_count": 1.617,
        "lever_id": "L04"
      },
      {
        "all_core_signal_ids": [
          "Q14",
          "Q17",
          "Q25"
        ],
        "allows_not_applicable": true,
        "capability_clarifier_id": "C_L05",
        "core_weight_sum": 1.4,
        "direct_core_item_ids": [
          "Q17"
        ],
        "effective_core_item_count": 1.815,
        "lever_id": "L05"
      },
      {
        "all_core_signal_ids": [
          "Q17",
          "Q18"
        ],
        "allows_not_applicable": true,
        "capability_clarifier_id": "C_L06",
        "core_weight_sum": 1.2,
        "direct_core_item_ids": [
          "Q18"
        ],
        "effective_core_item_count": 1.385,
        "lever_id": "L06"
      },
      {
        "all_core_signal_ids": [
          "Q16",
          "Q18",
          "Q19",
          "Q23",
          "Q46"
        ],
        "allows_not_applicable": true,
        "capability_clarifier_id": "C_L07",
        "core_weight_sum": 1.85,
        "direct_core_item_ids": [
          "Q19"
        ],
        "effective_core_item_count": 2.894,
        "lever_id": "L07"
      },
      {
        "all_core_signal_ids": [
          "Q20",
          "Q21",
          "Q31"
        ],
        "allows_not_applicable": true,
        "capability_clarifier_id": "C_L08",
        "core_weight_sum": 1.4,
        "direct_core_item_ids": [
          "Q20"
        ],
        "effective_core_item_count": 1.815,
        "lever_id": "L08"
      },
      {
        "all_core_signal_ids": [
          "Q19",
          "Q21"
        ],
        "allows_not_applicable": true,
        "capability_clarifier_id": "C_L09",
        "core_weight_sum": 1.2,
        "direct_core_item_ids": [
          "Q21"
        ],
        "effective_core_item_count": 1.385,
        "lever_id": "L09"
      },
      {
        "all_core_signal_ids": [
          "Q20",
          "Q22",
          "Q29",
          "Q44",
          "Q48"
        ],
        "allows_not_applicable": true,
        "capability_clarifier_id": "C_L10",
        "core_weight_sum": 1.85,
        "direct_core_item_ids": [
          "Q22"
        ],
        "effective_core_item_count": 2.894,
        "lever_id": "L10"
      },
      {
        "all_core_signal_ids": [
          "Q19",
          "Q23",
          "Q27"
        ],
        "allows_not_applicable": true,
        "capability_clarifier_id": "C_L11",
        "core_weight_sum": 1.4,
        "direct_core_item_ids": [
          "Q23"
        ],
        "effective_core_item_count": 1.815,
        "lever_id": "L11"
      },
      {
        "all_core_signal_ids": [
          "Q24",
          "Q25"
        ],
        "allows_not_applicable": true,
        "capability_clarifier_id": "C_L12",
        "core_weight_sum": 1.3,
        "direct_core_item_ids": [
          "Q24"
        ],
        "effective_core_item_count": 1.55,
        "lever_id": "L12"
      },
      {
        "all_core_signal_ids": [
          "Q17",
          "Q24",
          "Q25",
          "Q31"
        ],
        "allows_not_applicable": true,
        "capability_clarifier_id": "C_L13",
        "core_weight_sum": 1.75,
        "direct_core_item_ids": [
          "Q25"
        ],
        "effective_core_item_count": 2.568,
        "lever_id": "L13"
      },
      {
        "all_core_signal_ids": [
          "Q23",
          "Q24",
          "Q26",
          "Q32",
          "Q34"
        ],
        "allows_not_applicable": true,
        "capability_clarifier_id": "C_L14",
        "core_weight_sum": 1.95,
        "direct_core_item_ids": [
          "Q26"
        ],
        "effective_core_item_count": 3.098,
        "lever_id": "L14"
      },
      {
        "all_core_signal_ids": [
          "Q27",
          "Q44"
        ],
        "allows_not_applicable": true,
        "capability_clarifier_id": "C_L15",
        "core_weight_sum": 1.2,
        "direct_core_item_ids": [
          "Q27"
        ],
        "effective_core_item_count": 1.385,
        "lever_id": "L15"
      },
      {
        "all_core_signal_ids": [
          "Q28",
          "Q47"
        ],
        "allows_not_applicable": true,
        "capability_clarifier_id": "C_L16",
        "core_weight_sum": 1.2,
        "direct_core_item_ids": [
          "Q28"
        ],
        "effective_core_item_count": 1.385,
        "lever_id": "L16"
      },
      {
        "all_core_signal_ids": [
          "Q29",
          "Q32",
          "Q46",
          "Q48"
        ],
        "allows_not_applicable": true,
        "capability_clarifier_id": "C_L17",
        "core_weight_sum": 1.4,
        "direct_core_item_ids": [
          "Q29"
        ],
        "effective_core_item_count": 1.858,
        "lever_id": "L17"
      },
      {
        "all_core_signal_ids": [
          "Q30",
          "Q32"
        ],
        "allows_not_applicable": true,
        "capability_clarifier_id": "C_L18",
        "core_weight_sum": 1.2,
        "direct_core_item_ids": [
          "Q30"
        ],
        "effective_core_item_count": 1.385,
        "lever_id": "L18"
      },
      {
        "all_core_signal_ids": [
          "Q20",
          "Q31"
        ],
        "allows_not_applicable": true,
        "capability_clarifier_id": "C_L19",
        "core_weight_sum": 1.2,
        "direct_core_item_ids": [
          "Q31"
        ],
        "effective_core_item_count": 1.385,
        "lever_id": "L19"
      },
      {
        "all_core_signal_ids": [
          "Q26",
          "Q30",
          "Q32",
          "Q47"
        ],
        "allows_not_applicable": true,
        "capability_clarifier_id": "C_L20",
        "core_weight_sum": 1.6,
        "direct_core_item_ids": [
          "Q32"
        ],
        "effective_core_item_count": 2.286,
        "lever_id": "L20"
      },
      {
        "all_core_signal_ids": [
          "Q30",
          "Q33"
        ],
        "allows_not_applicable": true,
        "capability_clarifier_id": "C_L21",
        "core_weight_sum": 1.2,
        "direct_core_item_ids": [
          "Q33"
        ],
        "effective_core_item_count": 1.385,
        "lever_id": "L21"
      },
      {
        "all_core_signal_ids": [
          "Q26",
          "Q33",
          "Q34",
          "Q44"
        ],
        "allows_not_applicable": true,
        "capability_clarifier_id": "C_L22",
        "core_weight_sum": 1.4,
        "direct_core_item_ids": [
          "Q34"
        ],
        "effective_core_item_count": 1.858,
        "lever_id": "L22"
      },
      {
        "all_core_signal_ids": [
          "Q27",
          "Q35",
          "Q36",
          "Q41",
          "Q45"
        ],
        "allows_not_applicable": true,
        "capability_clarifier_id": "C_L23",
        "core_weight_sum": 1.85,
        "direct_core_item_ids": [
          "Q35"
        ],
        "effective_core_item_count": 2.882,
        "lever_id": "L23"
      },
      {
        "all_core_signal_ids": [
          "Q18",
          "Q35",
          "Q36",
          "Q38",
          "Q43"
        ],
        "allows_not_applicable": true,
        "capability_clarifier_id": "C_L24",
        "core_weight_sum": 1.9,
        "direct_core_item_ids": [
          "Q36"
        ],
        "effective_core_item_count": 2.996,
        "lever_id": "L24"
      },
      {
        "all_core_signal_ids": [
          "Q21",
          "Q37",
          "Q39"
        ],
        "allows_not_applicable": true,
        "capability_clarifier_id": "C_L25",
        "core_weight_sum": 1.45,
        "direct_core_item_ids": [
          "Q37"
        ],
        "effective_core_item_count": 1.907,
        "lever_id": "L25"
      },
      {
        "all_core_signal_ids": [
          "Q38",
          "Q40"
        ],
        "allows_not_applicable": true,
        "capability_clarifier_id": "C_L26",
        "core_weight_sum": 1.2,
        "direct_core_item_ids": [
          "Q38"
        ],